<?xml version="1.0" encoding="UTF-8"?>
<collection id="latin" xmlns="http://cudl.lib.cam.ac.uk/1.0/collection" xmlns:xsi="http://www.w3.org/2001/XMLSchema-instance" xsi:schemaLocation="http://cudl.lib.cam.ac.uk/1.0/collection collection.xsd">
   <title>Latin Manuscripts</title>
   <type>organisation</type>
   <metaDescription>A collection of Latin Manuscripts provided by Manchester University</metaDescription>
   <resources>
      <resource>
         <type>webcontent</type>
         <representation>html</representation>
         <target>summary</target>
         <location>collections/latin/summary.html</location>
      </resource>
      <resource>
         <type>webcontent</type>
         <representation>html</representation>
         <target>sponsors</target>
         <location>collections/latin/sponsors.html</location>
      </resource>
   </resources>
   <items>
      <item id="MS-LATIN-00008"/>
   </items>
</collection>
