<?xml version="1.0" encoding="UTF-8"?>
<collection id="darwin_mss" xmlns="http://cudl.lib.cam.ac.uk/1.0/collection" xmlns:xsi="http://www.w3.org/2001/XMLSchema-instance" xsi:schemaLocation="http://cudl.lib.cam.ac.uk/1.0/collection collection.xsd">
   <title>Darwin Manuscripts</title>
   <type>organisation</type>
   <metaDescription>A collection of Manuscripts Charles Darwin.</metaDescription>
   <resources>
      <resource>
         <type>webcontent</type>
         <representation>html</representation>
         <target>summary</target>
         <location>collections/darwin_mss/summary.html</location>
      </resource>
      <resource>
         <type>webcontent</type>
         <representation>html</representation>
         <target>sponsors</target>
         <location>collections/darwin_mss/sponsors.html</location>
      </resource>
   </resources>
   <items>
      <item id="MS-DAR-00100-00001"/>
      <item id="MS-DAR-00114-00001"/>
   </items>
</collection>
